{
  "schema": "urn:algaguard:schema:onboarding:credential-rotation-request:v1",
  "schemaVersion": "1.0.0",
  "rotationId": "44444444-4444-4444-8444-444444444444",
  "deviceUuid": "aaaaaaaa-aaaa-4aaa-8aaa-aaaaaaaaaaaa",
  "deviceId": "AG-000001",
  "currentCredentialId": "11111111-1111-4111-8111-111111111111",
  "requestedAt": "2026-07-24T01:00:00Z",
  "expiresAt": "2026-07-24T01:10:00Z",
  "overlapSeconds": 300,
  "reason": "ADMIN_REQUESTED"
}
